{
  "documentType": "code-security.findings",
  "findings": [
    {
      "attackPath": null,
      "confidence": {
        "level": "high",
        "rationale": "Direct source trace reaches the filesystem write without a containment check."
      },
      "extensions": {},
      "findingId": "csf_677a45ebd3f17059c36fd419",
      "fingerprints": {
        "algorithm": "code-security/v1",
        "primary": "code-security/v1:sha256:a18a904d38c1d6d96ca7a9426ea23be74961cec99dd92d03872d352ecaca5b6f"
      },
      "identity": {
        "anchor": "archive-entry-write-without-containment"
      },
      "locations": [
        {
          "endLine": 44,
          "path": "src/extract.py",
          "role": "sink",
          "startLine": 41
        }
      ],
      "occurrenceId": "occ_f7b97d325ded7b8d03c70066",
      "provenance": {
        "source": "local_plugin"
      },
      "remediation": "Normalize destinations and reject entries that escape the extraction root.",
      "ruleId": "path-traversal.archive-extraction",
      "severity": {
        "level": "high",
        "score": 8.1,
        "scoringSystem": "CVSS:3.1"
      },
      "summary": "An attacker-controlled path reaches a filesystem write without containment validation.",
      "taxonomy": {
        "category": "path-traversal",
        "cwe": [
          "CWE-22"
        ]
      },
      "title": "Unsafe archive extraction can escape the output directory",
      "validation": null
    }
  ],
  "scanId": "scan_example_001",
  "schemaVersion": "1.0"
}
